label,source,sentence
surprise,fairytale_sentences,"When spring came, the plant appeared in full bloom: a more beautiful object than any other plant in the forest."
surprise,tweets,"I know people say that power naps are good for you all the time, but I kinda always miss the alarm"
surprise,tweets,is waiting for the estate agent to do valuation. oh joy. *sigh* i need to be in the funhouse  pink baby come back!!!!
surprise,tweets,Cheers Tony!!!! Btw notice no swear words in my tweets!
surprise,fairytale_sentences,"The little louse has burnt herself, The little flea is weeping,
surprise	fairytale_sentences	The little door is creaking, The little broom is sweeping."
surprise,fairytale_sentences,"Catherine looked, but could not see where it had gone; so she said, ""Well, I suppose the other will go the same way and find you; he has younger legs than I have."""
surprise,tweets,"Bread in the oven, room cleaned... almost done with the things on the list for today"
surprise,fairytale_sentences,"But the ninth time it rose in the air, it remained away, and did not return."
surprise,tweets,... A kidney stone. Really?? Ugh
surprise,tweets,it was amazing
surprise,fairytale_sentences,And then all of a sudden--Miss Moppet jumps upon the Mouse!
surprise,tweets,really? and yeah it's too soon
surprise,tweets,and   why are u two fighting.
surprise,tweets,"- i'm really missing this place  my grandparents are living there, on the calm country! but im coming to them ..."
surprise,tweets,OMG.. THIS ONE??? YESSSSS love this Danny song
surprise,fairytale_sentences,"Is that a hill? said the youngest of the boys, pointing to the elf hill, ""we should call it a hole in Norway."""
surprise,tweets,Its humid today. Last night there was lightning. And now its humid
surprise,fairytale_sentences,"Mrs Fox asked: ""Has the gentleman red stockings on, and has he a pointed mouth?"""
surprise,tweets,is 99% sober at Brittney's with Becky and Brit  &lt;3
surprise,fairytale_sentences,"He looked down, and there was Bellissima, little smooth-shaven Bellissima, barking as if she would have said, ""Here I am too; why are you sitting there?"""
surprise,tweets,You're watching Firepro0f?
surprise,fairytale_sentences,"Oh, said he, ""what long nails you have!"
surprise,tweets,Cavs has the easier route than Denver.
surprise,tweets,yes i have read them many times.
surprise,tweets,I am horrible at appraising peer work. What are these Americans thinking when they compose poems? Or maybe I am the one with the problem.
surprise,fairytale_sentences,Suddenly he fancied he heard feet outside going pit-a-pat.
surprise,tweets,The bunuelos were a huge hit but i had to skip shopping afterwards.  let's see what kind of trouble i can get into here...
surprise,tweets,"OHMIGOD, I would have loved that. Alas, there was just lots of gun play. No dancing"
surprise,fairytale_sentences,Because the louse has burnt herself.
surprise,tweets,oh about you lol sorry my minds always on you
surprise,tweets,"finished work @ midday, had kiddie dinner ... now have no get-up ; go ... ah well it's bank holiday!   #fb"
surprise,tweets,Went to see UP today - very disappointed - it was sad   Almost made me cry!  I thought it was supposed to be funny.
surprise,tweets,coming back drom camp!!! there was no cell fone reception =0 so im so happy were back in QLD and a little bit tired
surprise,artificial_sentences,Rachel had been nonplussed .
surprise,fairytale_sentences,"When the three servants came to the forest, nothing was there but a rose-tree and one rose on it, but the children were nowhere."
surprise,fairytale_sentences,How great it is! how bright it is!
surprise,tweets,Oh that's why.
surprise,tweets,"At work surprisingly happy all things considered, ahhhh loveliness"
surprise,tweets,now there's a fly in my room
surprise,fairytale_sentences,He wanted his supper of little fat mouse!
surprise,fairytale_sentences,"And the willow-tree nodded his head, as if he would say, ""Indeed I do."""
surprise,fairytale_sentences,"Then the tailor started; for suddenly, interrupting him, from the dresser at the other side of the kitchen came a number of little noises--"
surprise,fairytale_sentences,Is it possible that I have been lying here in the street dreaming? said he.
surprise,tweets,wants to wish all the moms a Happy Mother's Day.  Hope you're all treated like Queens!
surprise,artificial_sentences,"Anne watched her for a few moments in stunned silence , trying to decide if she meant what she had said ."
surprise,fairytale_sentences,"Then the fox came, and said, ""Pray kill me, and cut off my head and my feet."""
surprise,tweets,... schedule says 10:30 class? I will be late for 10  #campjitterbug
surprise,fairytale_sentences,"Listen, what a drumming there is on the burdock-leaves; turn, turn, turn; turn, turn, turn, said the father-snail."
surprise,tweets,I have to spend lots of  our money on a new boiler...great!!! Not so lucky hey
surprise,tweets,mmm hmmm and big big bro too! I have a crush on David Knight.
surprise,tweets,I think he meant this pic - I don't know what other one he might have seen! But really - this is as hot as it gets
surprise,tweets,Hello  ...hehe yup we sure do ...lovely to 'see' you xx
surprise,tweets,To Lisa: Yes I know who ur talking about and yes he is an ass. Dont let him get to ya...you have a great thing going with this chris
surprise,tweets,lol happy you like it
surprise,artificial_sentences,By now Nutmeg was so bewildered that he did n't know what to do .
surprise,tweets,Boooo Animal collective is already sold out.  Guess I'll be missing that show
surprise,tweets,"my hundreth update  HAPPY MOTHERS DAY. i love you mum! even with all the fuss and fighting, you're still the one and only."
surprise,tweets,didn't make it out to shop.......      there is always tomorrow.
surprise,tweets,"Okay, make sure he's alright kk? Cuidalo. Let him know he's a got friend in us aha.."
surprise,tweets,I also found out that it's also my last youth group meeting
surprise,tweets,just got my first lesson in when rain meets my white  shirt   if one more man tells me they like my bra on more time! smh
surprise,tweets,Omg. i love my parents i juss got a lavender camera as an early birthday present!!!
surprise,fairytale_sentences,"Dummling thought of the little grey man, who could certainly help him; so he went into the forest, and in the same place where he had felled the tree, he saw a man sitting, who had a very sorrowful face."
surprise,tweets,"Oh, wow, you're fast   How's life going ? It's been 6 months ya ? XD"
surprise,artificial_sentences,"Athelstan sat in complete stupefaction , drinking his beer , as Cranston cleared every platter , washing it all down with another bowl of claret ."
surprise,tweets,OHH. haha ok thanks
surprise,tweets,#3breakupwords you have changed
surprise,fairytale_sentences,"It is quite shocking that one glass of punch should have upset me like this."""
surprise,tweets,i know!! No money for pedicures!!
surprise,tweets,i hate it when a website says the ticket prices are on another website and their not
surprise,fairytale_sentences,"Grand, dark, and gloomy appeared the landscape around him."
surprise,tweets,Warren and Hannah are dead ... oh my godd!! Seriousslyyy this is a tragidy !
surprise,tweets,"What you said about aj made no sense,hahaha. What were you talking about? And I loved that picture of you and colin!"
surprise,tweets,"Oh, yes... Happy NINE year annivarsary to Hanson's second studio album, &quot;This Time Around.&quot;"
surprise,tweets,I dont care what kind of graphics or engines video games have nowadays. They are nothing compared to The Oregon Trail and Carmen Sandiego
surprise,tweets,is on crutches!
surprise,tweets,"Home from Jack's now, can't say I'm too happy about that either"
surprise,tweets,NO WAY MAN! i like 21 year olds
surprise,tweets,you can still stay if you want to!
surprise,tweets,yes I am
surprise,tweets,I know it's not meeeee. Im surprised either  At least I get to laugh at myself UNLIKE SOME OTHER PEOPLE )
surprise,tweets,that is truly impressive. Can't come close to that. Takes the argument over whether web needs subs to a new level though
surprise,tweets,omg patron is 1ofmy FAVS    im so jealous icant do 10 but i can do 5 so make it 15  so serious im in alabama visitin fam
surprise,tweets,you're so gorgeous!!
surprise,fairytale_sentences,"During the two long years which followed, no letter came from Christina to her father; and when at last her father received one from her, it did not speak of prosperity or happiness."
surprise,tweets,awwwh u stuck in traffic  booo!
surprise,fairytale_sentences,"The emperor immediately sprang out of bed, and called for his physician; but what could he do?"
surprise,fairytale_sentences,"The others were all obliged to retire to a distance, and when the peasant looked at the priest, he recognized the man who had been with the miller""s wife."
surprise,tweets,OMG JLO AND MARC ANTHONY WERE AT MY OLD SCHOOL GRADUATION  BRB UPSET
surprise,fairytale_sentences,"You are exceedingly ugly, said the wild ducks, ""but that will not matter if you do not want to marry one of our family."""
surprise,fairytale_sentences,"When the witch and the young lady heard of his beautiful salad, they longed to taste it, and said, ""Dear countryman, let us just taste it."""
surprise,tweets,"Eatin dinna, herd tom brady not movin 2 fast"
surprise,fairytale_sentences,"My stars! said she, ""what shall I do to keep Frederick from seeing all this slopping about?"""
surprise,tweets,nice have fun....Although you cant not have fun lol
surprise,fairytale_sentences,"You must never go in there, said the yard-dog, ""for if you approach the stove, you'll melt away, away."""
surprise,tweets,lol i havent watched it yet..  congrats!
surprise,artificial_sentences,The anger and astonishment in her face gave way to something very like pity .
surprise,tweets,Not ah huge fan of getting up in the middle of the night to change peed sheets and underpants.
surprise,tweets,what are you doing here? I thought you were back at work today!
surprise,tweets,"Thought i saw the a-trak van, turns out its the Alcohol- TEAM van."
surprise,tweets,babe u aint been reading my tweets- my phone has fallen apart. My new on comes nxt wk. The track ball keeps fallin out my phone
surprise,fairytale_sentences,"There's another one of mine, said Lucie."
surprise,tweets,they can't be in their carriers anymore?
surprise,fairytale_sentences,"The eldest brother, he who fabricated bricks, soon discovered that each brick, when finished, brought him in a small coin, if only a copper one; and many copper pieces, if placed one upon another, can be changed into a shining shilling; and at whatever door a person knocks, who has a number of these in his hands, whether it be the baker's, the butcher's, or the tailor's, the door flies open, and he can get all he wants."
surprise,tweets,pulled up @ walmart aunt got out went in I fell asleep 2 hours later.... were r you?!  lol
surprise,tweets,Just woke up and catching up on the nightly tweets!!
surprise,fairytale_sentences,"Then he saw the ring which he had given to his first bride, and when he looked in her face he recognized her."
surprise,fairytale_sentences,"Hansel, however, stretched out a little bone to her, and the old woman, who had dim eyes, could not see it, and thought it was Hansel""s finger, and was astonished that there was no way of fattening him."
surprise,tweets,"OH WAIT, I read that wrong. OK hellboy"
surprise,tweets,Not yet! I'm going to tonight though
surprise,tweets,wowww!! havent twitter in like FOREVER!! all done with SAT! Finally! soo happy!  i think i did terribly but who cares! ITS DONE! lol
surprise,tweets,"Wow, really? I didn't know it was that serious.  Well that sucks. Texas must have been chock full of asbestos."
surprise,tweets,- Overwhelming lead for Strawberry Lemonade!!  My husband voted for Banana Fosters tho.
surprise,tweets,who said i can't wear my converse with my dress?
surprise,fairytale_sentences,"Wherefore do you weep, old willow-tree?"""
surprise,tweets,ha! you're right...I know you're right.
surprise,tweets,"Congrats!  I cuss like that in a matter of minutes, But didn't know until now there is a reward for it."
surprise,tweets,"walking the dog on horseforth park, no hangover on a Sunday morning, yay!!"
surprise,tweets,No surprise there. They probably don't know themselves where it is
surprise,tweets,Woke up and there was sun! And then it started to rain
surprise,tweets,Oh Duh....I see that now .....thank you....
surprise,tweets,lol how I met your mother
surprise,tweets,Mashup Monday! In honour of the swine flu hysteria  ?
surprise,tweets,"LOL I do too.... I can't take him back, I lost my receipt!"
surprise,tweets,Its coming out the socket  I feel like my phones hole is not a virgin. That's how loose it is... :'(
surprise,tweets,okay im happy again  i watched the second episode of jonas on youtube. i think tomorrow my family is going to olive garden for mothers day
surprise,fairytale_sentences,"As I could not conceive from whence it came, I wanted to summon my waiting-maid who slept in the next room, but to my astonishment I found that speech was taken away from me by an unknown force."
surprise,fairytale_sentences,"Have you not strength enough to hold the weak twig?"""
surprise,tweets,wut u want a shot of ma?
surprise,tweets,is missing her best friend..... and i only saw them this afternoon  How sad am I!!!!
surprise,tweets,ohh i would def give it 2 u but tht was kenyatta's cam not mine  sry but i want tht pic 2
surprise,tweets,"Not to worry, noone got that one. Next question starts in 1 minute, get your thinking caps on"
surprise,tweets,is confused
surprise,tweets,HAPPY MOTHERS DAY!  Tell ur mom that's she an awesome madre ; such a great example to the Archuleta familia!!
surprise,tweets,I want to dance with you too  I haven't really listened to that song since you left. It makes me miss you more
surprise,tweets,no labels?  Sorry I know I'm really needy.
surprise,tweets,You realllllllllly just said that didn't you?
surprise,tweets,"lolzz @ public script, wait  - n- watch"
surprise,tweets,No betta nest  I think despite the heater it gets too chilly at night
surprise,tweets,what's going on ?
surprise,tweets,ommg gurll why aren't u going how sad
surprise,tweets,"ooft what pub? I'm off 2moro, but I have a backlog of what people call work to finish. Doubt I'll do it"
surprise,tweets,That mango shake made ALL the difference.  -
surprise,tweets,"Sounds a bit Alan Partridge  A-ha! (Good morning, by the way)"
surprise,tweets,I'm writing from my BlackBerry now.
surprise,tweets,MegaMan 2.5D... wow! Capcom please don't chuck a 'Square-Enix' and put a Cease and Desist order on this project
surprise,fairytale_sentences,Where are the butter and cheese? said he.
surprise,artificial_sentences,He looked quite nonplussed .
surprise,tweets,no idea what that means bb
surprise,tweets,wants this summer to actually have some sun in it
surprise,artificial_sentences,"Upon his arrival , he was nonplussed to find the yard and buildings deserted ."
surprise,tweets,a bit too early for me and wanting to have nice lunch too... have a good time
surprise,tweets,"Gonna WoW for a bit. Later, Twitter &lt;3"
surprise,tweets,samee well i aint a man i am a girl obv nd i am 14 lol   i aint no1 special or not famous or rich  wish to be tho xx
surprise,tweets,"ahh seen a few of those drop, but I just tossed them thinking it was a once only turn in"
surprise,fairytale_sentences,"She opened the door of the TOP oven;--out came a rich steamy flavour of veal and ham, and there stood a fine brown pie,-- and through a hole in the top of the pie-crust there was a glimpse of a little tin patty-pan!"
surprise,tweets,if someone had've told me things would get this hard..i would never have done it
surprise,fairytale_sentences,"All-gone, cried the mouse ""that is the most suspicious name of all!"
surprise,artificial_sentences,"She seemed flabbergasted , but rallied and asked me if I would look in at the Gray Mare in Kilburn and say ` hello "" to her son Joe Kelly who worked there ."
surprise,tweets,Wow! I am impressed Pastor Lucas! Great work!!!
surprise,tweets,"wow! ever notice that some twitters have thousands of followers, yet they only follow a handful (actually, less than two hands) of peeps."
surprise,tweets,never expected to hear Beastie Boys in a Star Trek movie... was a super great flick though. *pew peww* -- (phasers)
surprise,fairytale_sentences,She felt surprised and uncomfortable.
surprise,tweets,"--of them kinda turns me off of it all.  And then I buy more of them and dig a deeper hole, etc. ;;"
surprise,tweets,"Good plan, Peg --plus I like the sound of &quot;Money Monday&quot;"
surprise,fairytale_sentences,Baa! there he stood like a baa-lamb.
surprise,artificial_sentences,"He added : ` I 'm astounded he has not been on the fringe of the Dutch team . """
surprise,tweets,anychance you can get matthew to give a shout out to my mum Sarah for mothers day! we saw &quot;Ghosts from girlfriends past today&quot;
surprise,fairytale_sentences,"How did you get all this money? asked Great Claus, staring with wide open eyes at his neighbor's treasures."
surprise,tweets,"Methinks it's time to read A Doll's House + Streetcar and get some quotes, and then PHYSICS!"
surprise,tweets,Why is it so dark outside?
surprise,fairytale_sentences,"Then the peasants were astonished, and said: ""Peasant, from whence do you come?"
surprise,artificial_sentences,I can understand the apparent stupefaction of all parties .
surprise,tweets,"Wait - No Wind in Hair - that would be I-L-L-E-G-A-L!!  I would Never break the law!! No, never."
surprise,tweets,Cheeeessseee! We were in Ireland when the latest W;G aired. In-laws had to put up with my blocking the telly on Christmas Day.
surprise,artificial_sentences,Zen was so astounded at finding Cinzia there on that particular evening that he could think of nothing whatever to say .
surprise,fairytale_sentences,"Lucie scrambled up the stile with the bundle in her hand; and then she turned to say ""Good-night,"" and to thank the washer-woman.--But what a VERY odd thing!"
surprise,tweets,NEW FRIEND?? hmmm... tell me more
surprise,tweets,awwww it ovber!!!
surprise,fairytale_sentences,"What is the matter with me?"""
surprise,fairytale_sentences,"Then Mrs Fox said: ""Has the gentleman red stockings on, and has a little pointed mouth?"""
surprise,tweets,"I have the best bestfriend in the whole world .. My Mother's Day present = ambien, klonopin and a quarter! woohoo!  smh..."
surprise,tweets,cant believe tila tequila was in ct and i didnt know... so upset
surprise,tweets,"really?  i'm in greensborough, but prev bundoora.."
surprise,fairytale_sentences,"Then just as he was going to fire at him, it occurred to him that the wolf might have devoured the grandmother, and that she might still be saved, so he did not fire, but took a pair of scissors, and began to cut open the stomach of the sleeping wolf."
surprise,tweets,awesome! thank you
surprise,fairytale_sentences,"All in a minute she rushed upon Tom Kitten, and before he knew what was happening."
surprise,tweets,Love johnny deep looks in public enemies (L) I'll catch this film when show in HK
surprise,fairytale_sentences,"Dead! cried the laundress, turning pale as death."
surprise,tweets,"re:firmware. Heh, just a coincidence. I didn't do anything. Maybe the SW guys heard you?"
surprise,tweets,Feeling much better  Doing History Research.
surprise,tweets,boston needs one too
surprise,tweets,"He hated my writing, so I made him my academic adviser."
surprise,tweets,Oops that would be #edaust09
surprise,tweets,I got me to watch it.  Recommend some other kickass shows too. Phast!
surprise,artificial_sentences,"She saw his fear , his bewilderment , and above all , a kind of astonishment at the enormity of the complications that lay ahead ."
surprise,tweets,where are you? In Bris? I can't hear any thunder
surprise,tweets,Goodnight!!!!!!
surprise,tweets,awww the wee gril in britains got talent
surprise,tweets,that is definitely a blast from the past
surprise,tweets,oh really? why HELLO there
surprise,tweets,"Baby girl scraped her leg in a bike accident today. Couldn't find any gauze, had to use panty liners and medical tape to patch her up."
surprise,tweets,tee we beefin....what was u supposed to do before leavin????
surprise,tweets,Aww the little girl on Britain's Got Talent!  I actually love Ant n Dec!  Oh an' Simon Cowell. ;)
surprise,tweets,well its time to hit the hey stack night yalls  TOMORROW IS MOTHERS DAY!
surprise,tweets,what question? oh I'm not around tonight...
surprise,tweets,oh no your poor car's testicles
surprise,fairytale_sentences,"Then good food was set before them, milk and pancakes, with sugar, apples, and nuts."
surprise,tweets,Happy Mother's Day!
surprise,fairytale_sentences,"Now all this time the ale was running too, for Catherine had not turned the cock; and when the jug was full the liquor ran upon the floor till the cask was empty."
surprise,tweets,I could see your quote but not vote for it??
surprise,tweets,Extremely happy to see my new track &quot;The Awakening&quot; featured on Indivibe
surprise,tweets,"that little girl on BGT  omggg, how can people not feel sorry for her?"
surprise,tweets,i just posted it like 5 mintues after you got off
surprise,tweets,getting rained out @ the devon horse show.  *head desk*
surprise,artificial_sentences,Laura stared up at Ross in stupefied amazement .
surprise,tweets,I didn't see this until after
surprise,tweets,"Calling all mothers, calling all mothers...get your butts to bed - the kids'll be here tomorrow"
surprise,tweets,It's surprising how much Billy Idol turns up in tweets. I monitor constantly - not that I'm obsessed or anything!  #BillyIdol
surprise,tweets,i dont know! they sent out emails using my account about random stuff i didnt even understand i changed all my passwords
surprise,tweets,Fun game of 'Candamir' with the kids last night. Can't believe it's now our last day
surprise,fairytale_sentences,"When Tom Kitten picked himself up and looked about him, he found himself in a place that he had never seen before, although he had lived all his life in the house."
surprise,tweets,Back in a mo. Cover Girls hubby on fb chat. She not seen him for 5 months
surprise,fairytale_sentences,"The other roses looked after their sister, and asked each other, ""Where can she be going to?"""
surprise,tweets,Anddd justin. Eff
surprise,tweets,"Would *you* pay $60K for a lunch with Oscar de la Renta?  I don't see her hitting East Village shops, do you?"
surprise,tweets,i believe that you are
surprise,tweets,Having dinner with my grandma since I couldn't be with my mum.
surprise,tweets,Waiting for my turn on wii fit gym closed
surprise,fairytale_sentences,"Yes, indeed, my dear Ribby; where can it have gone to? said Duchess."
surprise,artificial_sentences,"` Carpenter ? "" her father asked with a tinge of bewilderment in his voice ."
surprise,tweets,"No, I haven't seen it yet!  But once it comes out on DVD.. ;) hehe. Haha"
surprise,tweets,oh mann... Me likey that!! But sadly I'm not bein auctioned on #twpp tonight
surprise,fairytale_sentences,"The servant ran after his master and told him what had happened, but would not leave his saddle behind him, and ran back to fetch it."
surprise,tweets,3 day weekend and all I can think of is work waiting to ambush me on Tuesday!   Damn you work!!!
surprise,tweets,headed into venue.  bbl
surprise,tweets,just found out that i'm a robot
surprise,fairytale_sentences,"The second prince set out soon afterwards on the same errand; and when he came to the golden road, and his horse had set one foot upon it, he stopped to look at it, and thought it very beautiful, and said to himself, ""What a pity it is that anything should tread here!"""
surprise,tweets,I don't think I am going to get to see any of the sun today  gutted I NEED COLOUR!
surprise,tweets,Just saw Zack and Miri Make a Porno with   and   . sooo good.
surprise,tweets,"Energy steadily increasing, thankfully, but the cough isn't going away."
surprise,tweets,"dinner smells good...man i'm hungry. so sunny outside, wish i was at wonderland"
surprise,tweets,Lucky me. There are mystery ingredients as well
surprise,tweets,Yay! Lets welcome Mrs Mcnugget to twitterverse!
surprise,tweets,Alternate name for a &quot;Bacon Mary&quot;... A &quot;Bloody Piggy!&quot; ;) (I have to give my boyfriend credit for that idea!)
surprise,artificial_sentences,The man turned round and looked at Robyn with startled eyes .
surprise,fairytale_sentences,But what a horrible surprise!
surprise,tweets,you gotta follow &quot;BOOBFEED&quot; its incredible. They tweet 4-10 a day. With links to free breasts. Its my favorite tweeter
surprise,tweets,just realized i have 30 followers HEY GUYS
surprise,tweets,really? cuz KC.com said it was releasd 24/4 here n the main station doesn't even hav it
surprise,tweets,"getting dressed to go to Granny's,another day of now twitting"
surprise,tweets,Less than 24 hours till the show! Oh and Lee broke his guitar at practice
surprise,artificial_sentences,The girl looked startled .
surprise,tweets,"First fail, cant tweet from phone. Oh how I love my work phone"
surprise,tweets,they r the most random things that my mind can churn..as the Chennai heat gets to me I can assure u these will b more often.
surprise,tweets,Not yet.   Did you?
surprise,tweets,off to my cousins confirmation + confirmation party
surprise,tweets,"I quite enjoy this Lady Gaga person. She's of Italian heritage, apparently.  ?"
surprise,fairytale_sentences,"The maiden found everything exactly as the old woman had said, and on her way back she found her two brothers who had sought each other over half the world."
surprise,tweets,"Finally back in bed with my puppies after a LONG week in Jamaica. loved it, but lve to be home too!! Night"
