label,source,sentence
guilt,emotional_events,I broke the gutar of a colleague but as it happened in a moment when nobody was present I could escape from the guilt.
guilt,emotional_events,"I had known the girl for a few months when I proposed to her and this put an end to our friendship, as from then on we started withdrawing from each other.  I liked her very much."
guilt,emotional_events,My mother developed hipertonia and I think I too am to blame bacause with her it is a stress disease.
guilt,emotional_events,"I slapped my sister's daughter and after several hours, she had a high temperature and she ended up being admitted in hospital."
guilt,emotional_events,I beat up a female friend after I heard the defamatory stories that she had been telling.  I was later called to explain my behaviour.
guilt,emotional_events,I had promised to call a girl but I did not do it.
guilt,emotional_events,A person I was attracted to walked me home in the rain and got sick.
guilt,emotional_events,"For the above: guilt at not living up to my own moral expectation, guilt for not being the type of person my patents wanted, guilt for just about bloody everything, just realising that I have failed drastically in my own eyes."
guilt,emotional_events,Remembering (at the time I did not feel guilt) in recent yrs. how angry I would get when I was babysitting my new brother and he would not stop crying. I did not do anything harmful or shocking. But I feel guilty for treating him the way I did especially since I adore him now. That's why I spoil him now.
guilt,emotional_events,I said something which was against my conscience.
guilt,emotional_events,"When my friend failed an exam by just one mark.  During this exam she had asked me to show her my answer sheet and I had not done it.  When the results came out, I thought that had I shown her my answer sheet she would have passed the exam.  I felt guilty as I had failed her."
guilt,emotional_events,Not handing in homeworks in time.
guilt,emotional_events,When I don't justify the confidence of people that I respect.
guilt,emotional_events,I had fixed a meeting with my classmates and I missed it as I was tired.  Besides everyone at the meeting was a stranger to me and I did not want to make friends with them.  Whatever the reasons - I  felt guilty.
guilt,emotional_events,When my mother scolded me and I argued with her.
guilt,emotional_events,When I was bluffing in front of my mother to get more money.
guilt,emotional_events,My schoolmates were teasing a pupil who was not able to defend himself very well; I should have taken his part.
guilt,emotional_events,I forgot to water the flowers in our flat and was rebuked by my friends who share the flat with me.
guilt,emotional_events,My mother wants to talk very often about her life. I dislike this because she always talks negatively about the same people whatever I do it doesn't help.
guilt,emotional_events,When something went wrong for me I lashed out at someone else whom I loved and who was not in any way responsible for what had happened (my sister).
guilt,emotional_events,Not collecting letters for my friend al I promised.
guilt,emotional_events,"When I got low marks in the final year B.Sc exams, I felt guilty as I had not worked hard because I had been roaming around with my  friends."
guilt,emotional_events,A few days back my mother was not feeling too well and still did all the house work.  I felt guilty as I had not offered to help.
guilt,emotional_events,"When I laughed at a lame man walking down the road, it looked funny at the time but later I felt lousy.  It was the same day that I had stolen some coins from my mother in the shop."
guilt,emotional_events,After I had cheated my parents that I had lost my textbooks so they had to send me money.
guilt,emotional_events,I have cut loose from my father a few years ago. I know he is very sad about this.
guilt,emotional_events,When I hit my young sister without a valid reason.
guilt,emotional_events,[ No response.]
guilt,emotional_events,Classes were over and I wanted to go home.  A friend of mine asked me to wait for half an hour to take him back home.  I said no.
guilt,emotional_events,Said something I should not have said in public.
guilt,emotional_events,When I finished a love affair where I was responsible of the sad end.
guilt,emotional_events,I was entrusted with an object and while using it I handled it carelessly and it broke.
guilt,emotional_events,"At a party, several comments were made about the personal situation of one of the people present.  She was rather affected and uncomfortable."
guilt,emotional_events,When I arrived home late at night.  I know that my mother gets worried and this made me feel angry.
guilt,emotional_events,I promised to join a meeting but did not turn up as I did not want to do the work.
guilt,emotional_events,"When I met another person I began to go out with him, and my boyfriend (with marriage accorded) met us together he did a great scandal, he broke the engagement and I began to go out with the other, and it didn't work because my mind was all mixed up."
guilt,emotional_events,"Feeling guilt after greed, buying chocolate and pigging out to the point of feeling sick, especially as I am fat."
guilt,emotional_events,The time that I had to put my dog to sleep.
guilt,emotional_events,Not acting on my promise.
guilt,emotional_events,I dreamed that this girl and I were cuddling in bed when my girlfriend walked in. I really love my girlfriend so I felt guilty and sad. I know that this is a wierd example but the dream and the feeling was clear to me as if it had really happened.
guilt,emotional_events,When I did not succeed in finding a job after having finished a nonacademic degree.
guilt,emotional_events,I was not able to explain well to my good friend to make him less angry.
guilt,emotional_events,"When my ex-husband left our house, and the children cried because he was not coming back."
guilt,emotional_events,It happens to me quite often. I can't describe a particular case.
guilt,emotional_events,Not speaking to my sister-in-law due to lack of interest in a relationship on my side.
guilt,emotional_events,When I failed an exam for which I knew that I had not studied hard enough.
guilt,emotional_events,I borrowed my friend's radio cassette and the plug cracked and some pieces broke off when the plug dropped off my hands.
guilt,emotional_events,I used to have two boyfriends in the past. Then one of them wanted to get engaged to me. I agreed but was guilt-conscious for disappointing the other one.
guilt,emotional_events,This is a kind of confession - my mum found me stealing meat from the pot.
guilt,emotional_events,In the past I used to think that my mother was a very nagging person.  When I started living at the hostel we had little time to meet each other.  Whenever I went home she would take care of me.  I gradually realized that what she had done was for my own good.  So very time I saw her I felt guilty.
guilt,emotional_events,"One day my mother went to visit her friends.  When she came back she scolded me for not having kept the house in order, so I decided not to talk to her."
guilt,emotional_events,When my husband discovered I was having an affair with another man.
guilt,emotional_events,Not finishing homework in time.
guilt,emotional_events,When I didn't bring my girlfriend home one night. Later she told me that a cardriver solicited her.
guilt,emotional_events,"When I was baby-sitting at my cousin's place, I tried to have a pleasant time and did not really take care of the child.  I do not care very much about children."
guilt,emotional_events,I left a boy with whom I was going around without giving him any explanations.
guilt,emotional_events,Once I worked as a designer. A fitter was hard hit in a damage that occurred at the building site I had designed.
guilt,emotional_events,[ No response.]
guilt,emotional_events,"When my parents work very hard and get tired - while I go to school and study instead of helping them. I feel that I'm letting them down, disappointing them."
guilt,emotional_events,Did not get up early enough to watch my class football team playing against another team.
guilt,emotional_events,I stole a coconut cake from a reception table and when I put in my mouth I realized that the host was watching me.
guilt,emotional_events,Not getting an airplane ticket fot my mother.
guilt,emotional_events,"At a party, I started talking to a guy I had seen in one of my classes. My boyfriend felt awkward and left to talk to a friend but kept on looking at me as I talked."
guilt,emotional_events,When I accepted a lunch invitation from a past male friend.
guilt,emotional_events,"I was so excited once that I told my classmate that she was old, this hurt her and I felt guilty."
guilt,emotional_events,"I took my grandmother's money without telling her and when asked if it was me who had taken the money, I denied it."
guilt,emotional_events,Having been angry and unpleasant towards my parents.
guilt,emotional_events,"I went to go get a bike innertube fixed. I fixed it and I was supposed to pay previously but I didn't. I said I would after I fixed the tire. After fixing the tire, the salesperson who helped me was gone so I walked out of the store without paying. I felt guilty so I went inside and paid for the tire."
guilt,emotional_events,When I realized that not all my friends like the comments that I pass in their presence.
guilt,emotional_events,"When I was young, I stole some money from my mother's purse. It wasn't very much, but I can remember when she found it gone I felt very guilty."
guilt,emotional_events,Against the will and without the approval of my parents I went for a few days to my boyfriend in Germany.
guilt,emotional_events,The first time I went away with my boyfriend and lied about where we were staying.
disgust,tweets,"have to go meet tims entiiiiire family in an hour, this should be different.. finishing getting ready then wake ; feel like shit still"
disgust,emotional_events,When somebody who had been a bully and had acted cruelly to others who were unable to defend themselves was taken down a few notches and he began to grovel. I was disgusted with his grovelling and the manner in which he had treated others.
disgust,emotional_events,"When an employer of my younger sister (17 yrs) made a \pass\"" at á|her."""
disgust,tweets,1:36 AM screw it im going to bed... one love
disgust,emotional_events,When I read racist slogans on the walls.
disgust,emotional_events,When I saw a wino by some cans with Food Stamps and use the change to buy wine.
disgust,fairytale_sentences,"Gout in my back, ugh."""
disgust,emotional_events,When I was the South Koreans on the TV.
disgust,fairytale_sentences,Our worshipful judges don't appear to have noticed this at all.
disgust,fairytale_sentences,"The hen who had lost the loose little feather naturally did not recognise her own story, and being a respectable hen, said: ""I despise those fowls; but there are more of that kind."
disgust,fairytale_sentences,"That is a dangerous woman, said the old goblin; and the two sons walked out of the hill; they had had enough of it."
disgust,emotional_events,Over an argument.
disgust,emotional_events,When I heard about the disaster in Bophal (India).
disgust,emotional_events,When a classmate of ours knocked on our door at 2 o'clock in the morning.  I was disgusted at his behaviour.
disgust,emotional_events,While walking in town I noticed how the police harrassed a man who was under the influence of alcohol.  They terrified him with the thought of arrest by driving close behind him on a pedestrian street.  My disgust was directed at the gestures and the facial expressions of the policemen; they seemed to be enjoying themselves.
disgust,tweets,"my neighbours are far too loud in thier back garden, all I can hear is this loud woman that won't stop laughing"
disgust,emotional_events,[ When mix was coming from column for several days.]
disgust,fairytale_sentences,"They are like wet wood, he would say, looking round to see what sort of people were present, ""this evening; nothing fires them."""
disgust,emotional_events,"When Kanishka was blown up, I really felt disgusted at people killing each other."
disgust,emotional_events,Heard someone boasting his fortune telling and I knew he was lying.
disgust,emotional_events,I met my best friend's husband with a prostitute.
disgust,emotional_events,When I boarded Yanu Yanu bus I sat near a man who was smoking tobacco.
disgust,emotional_events,Hear people talking at my back.
disgust,tweets,is not liking the online livebox right now. Internet is dead.
disgust,tweets,Gogol Bordello &lt; par.    Prolly not even in the top 10 of GB shows I've seen.   Perhaps some old fashioned Civilization II will help?
disgust,emotional_events,Some boys not cueing in the dining hall.
disgust,emotional_events,I was reading in the paper the feature on Henry Lucas who claims to have killed 380 people. He was a recreational killer and a necrophiliac and zoophiliac. He has raped and beaten many women and killed men too.
disgust,emotional_events,A person that eat half of a cockroach in a cake without knowing it.
disgust,emotional_events,"A study visit to a chicken factory : the butchery, the smell, the environment and the noise."
disgust,emotional_events,"In school I had difficulties mith mathematics. When I had to work for an examination, I really felt disgusted."
disgust,emotional_events,"When a \friend\"" woke me up in the middle of a blessful sleep by á|knocking on the door.  Then he started calling me names and á|saying that he had heard that I had been talking behind his back, this á|was a lie and the guy was drunk to the core."""
disgust,emotional_events,"When my demand for accomodation on the campus was refused and the rooms were allotted to first year students who were from \Rucher\"" á|and came from influential families."""
disgust,tweets,bored fixed the internet for my dad but now im bored to death
disgust,emotional_events,I was at home and I heard a loud sound of spitting outside the door.  I thought that one of my family members would step on the spit and bring the germs in the house.
disgust,fairytale_sentences,"That was a terrible affair in a hen-roost.
joy	fairytale_sentences	There it goes,"" she said; ""the more I pluck, the more beautiful do I get."""
disgust,emotional_events,A TV program on whale-hunting.
disgust,fairytale_sentences,"To have wings and fly! why, I can do that already;"" and so saying, he spread his wings and flew away."
disgust,emotional_events,A boy in my class talking too loud in the lecture.
disgust,emotional_events,I saw in the street a man spitting.
disgust,emotional_events,Bus driver driving roughly - old man fell off seat into aisle - driver wouldn't stop - disgusted with her behaviour.
disgust,emotional_events,"The carterer refused to give me sugar to add to my tea saying that there was no sugar whilst it was there, so I left the cafe disgusted without taking the tea."
disgust,emotional_events,When I saw a T.V programme on animals in the film world (mistreated and used).
disgust,artificial_sentences,"Darren , looking small and extremely disgruntled , was slumped in the front left-hand seat ."
disgust,emotional_events,"When an acquaintance of mine told me about the way his parents treated their sons in an unequal manner.  The most successful of them got continuous encouragement, and the youngest was not encouraged and was rejected."
disgust,emotional_events,A drunken man forced me to kiss him.
disgust,tweets,"Just got home from the bank, the teller was definitely hitting on me. Not interested."
disgust,artificial_sentences,"Zen preferred to think that some alert recruiting officer somewhere , realizing the appalling threat a disgruntled Gilberto would pose outside the law , had bent the rules to let him in ."
disgust,emotional_events,"When a member of the family complains about the food that is served, it disgusts me."
disgust,fairytale_sentences,"And the bees told it to their queen, who commanded that the next morning they should go and kill the murderer."
disgust,emotional_events,When a boy I hated most in our classroom took my T Jersey from my desk and put it on.
disgust,emotional_events,"A girl, who is a friend of mine was having an affair with a boy who is also a friend of mine.  I got to know that this girl was also seeing another guy.  Later on, she just broke off with this friend of mine without giving any explanations.  This made him sad and depressed, and I felt disgust for this girl."
disgust,fairytale_sentences,"I got tired at last of those endless Madonnas; I began to think I was turning into a Madonna myself."""
disgust,emotional_events,When I found out the CIA was mining Nicaraguan harbors.
disgust,emotional_events,My mother was very angry with my little sister and told her to put her hands on the table in order to beat her hands up. She forced by means of her power.
disgust,emotional_events,When I saw a girl in my economics discussion section smiling and asking stupid questions to the TA. just to get attention. She was obviously ass-kissing. It happens in every Econ. discussion held weekly.
disgust,artificial_sentences,"They can be happy and cheerful but they can also get fed-up , frustrated , angry , disappointed and hurt inside -- just like real people ."
disgust,fairytale_sentences,"Very well, said she; and they set out: and as Frederick walked the fastest, he left his wife some way behind."
disgust,fairytale_sentences,"You need not be in a hurry; you are always so impatient, and the youngster is getting just the same."
disgust,emotional_events,When mum had beaten my young sister just because she had received a letter from a boyfriend.
disgust,emotional_events,"I met three drunk boys, almost children, they didn't look like normal people."
disgust,emotional_events,When I saw a male engineer one year and came back to find he was now a female (I don't know it/them personally).
disgust,emotional_events,About my girlfriend's sister who is a viper as I discovered some time ago.
disgust,emotional_events,Friends who torture animals.
disgust,emotional_events,Once at a camp a classmate criticized me in front of others.  Now I find that this classmate is very disgusting.
disgust,emotional_events,"In my village there was this tax collector who used to cheat people and collected more than was wanted, the surplus was for his family and himself."
disgust,artificial_sentences,We were feeling rather disgruntled at how many good films we 'd obviously missed when a man came on to the stage to read the nominations for one of the categories .
disgust,tweets,1-Pendulum = awesome! 2-Goodbyes suck  3-Shut up plz. 4-Toy Story 3!!  5-JB 3D MOVIE 2MORO! 6-I'm tired. 7-Aaaand I'm out.
disgust,emotional_events,"When my friend got very low marks in field work even though he had worked throughout the year, I had this feeling."
disgust,emotional_events,I was dancing Malipenga (traditional dance). I exaggerated the steps I was supposed to make in the negative way. This happened in front of spectators. It was bad for our Boma (group) because I was on the front line where ability is displayed and it is this ability that counts when choosing the winning side.
disgust,emotional_events,"When I learnt that my offer to study at the university had been withdrawn  and so I would not get hostel accomodation at UNZA, even though I registered as a student later."
disgust,fairytale_sentences,"The fourth was too pale, and she called him ""Wallface."""
disgust,emotional_events,I was sitting in a station-hall and watching a lavatory attendant. She was very dirty. She started to eat something out of a dirty cup - it must have been something like lard. Then she took some breadcrumbs out of the pockets of her apron and ate them. I had to leave - I felt like vomitting.
disgust,emotional_events,"I stayed for several weeks with a friend of mine before she moved to live with her husband. One evening he came drunk and made an awful scene, which I still remember."
disgust,emotional_events,I was disgusted with the behaviour of one of my fellow students during my Secondary School life. He was a habitual noise-maker and caused great conflicts with the teachers.
disgust,artificial_sentences,`` I am outraged and revolted by the decision of my supervisors .
disgust,emotional_events,The first time that I saw a surgeon cut off a leg and put it in a black rubbish bag.
disgust,emotional_events,When I see rotten meat.
disgust,emotional_events,"Discovering a good friend had lied to me, resulting in a detrimental relationship with another person."
disgust,artificial_sentences,"Now the special envoy of the UN High Commissioner for Refugees , Jose-Maria Mendiluce , says he is revolted to hear those words from Mr Boban ."
disgust,emotional_events,"In the evening, while I was watching TV, my little brother came in and started eating food he had brought from the kitchen while I was trying to concentrate on the program."
disgust,emotional_events,"Political and military trnsgressions around the world, generally speaking. This cannot be described through this questionaire."
disgust,emotional_events,I got disgusted with a man who was beating a woman in the street. I just happened to be there but I was abhorred by the rudness.
disgust,emotional_events,When I see dead dogs on the road.
disgust,fairytale_sentences,"But she only answered, ""A nice thing to ask me to do, one of the apples might fall on my head,"" and passed on."
disgust,emotional_events,I received a letter which was too strong for me. It said I had done something which I really didn't do.
disgust,emotional_events,In secondary school I had a class-mate who talked too much.   Once we went to the cinema after school and she sat next to me and commented the movie throughout  - very disgusting.
disgust,fairytale_sentences,"Her own child, whose head she had cut off, bathed in her blood."
disgust,emotional_events,"The time I knocked a deer down - the sight of the animal's injuries and helplessness.  The realization that the animal was so badly hurt that it had to be put down, and when the animal screamed at the moment of death."
disgust,artificial_sentences,Woody Allen wrote and directed this comedy in which he stars as New Yorker Isaac Davis who is in love with his city but disgruntled with his job as a TV comedy writer .
disgust,fairytale_sentences,"Now I must beg you not to say that again, said Big Claus; ""for if you do, I shall hit your horse on the head, so that he will drop dead on the spot, and there will be an end of him."""
disgust,emotional_events,The price I was charged for work on my car.
disgust,emotional_events,I have an adopted Aboriginal sister I felt disgust due to the racism she has been subjected to.
disgust,emotional_events,When I study my butt off for a midterm and still get an average grade.
disgust,emotional_events,"One day, when I was twelve years old, my brother took some slimy substance swimming on the surface of a pot of vinegar made of cider and threatened to throw it at me."
disgust,emotional_events,At a gathering I found myself involuntarily sitting next to two people who expressed opinions that I considered very low and discriminating.
disgust,artificial_sentences,"It linked the poor performance with the exodus to the West of more than 330,000 East Germans disgruntled with Communism ."
disgust,artificial_sentences,It is unfortunate that such considerations may be thrust out of view by continuing public -- and perhaps personal -- revulsion towards the concept of child sexuality .
disgust,emotional_events,"When I was a teacher in an evening school, a girl raised a lot of questions and expressed her opinions.  She, very often, took a stand which was different from mine and she thought that it was better than mine.  Her opinions were helpful academically, but  she did not take into consideration my position in public.  Also she seemed to be very talkative and so she disgusted me."
disgust,artificial_sentences,"` T was to stop you becoming completely distraught , but I was afraid to look at you , afraid to come to you that night in case I saw fear or revulsion in your eyes . """
disgust,emotional_events,People who discriminate other people disgust me.
disgust,emotional_events,I felt disgusted at the environment while getting back to my student lodging. I did not see anything in the suburb which had been planned by taking people's comfort into account.
disgust,emotional_events,"In the army, an acquaintance of mine tended to use his position to advance his own interests."
disgust,emotional_events,One evening when a boy who was drunk made a pass at me by trying to kiss me.
disgust,emotional_events,"I had some sort of a stomach virus last week and  I vomited in college in the morning, then in the cake shop, three times during the trip home and again when I got home."
disgust,emotional_events,When a girl that I liked didn't accept my curting.
disgust,emotional_events,A pig in the well from which we drink.
disgust,emotional_events,"This is difficult, since I don't remember feeling disgust towards anyone."
disgust,emotional_events,A man sexually aggressed a small girl in the bus but the girl did not dare to speak out.
disgust,emotional_events,"A friend and a girlfriend went to Rome for 10 days with their class. When they were back home I heard people tell \strange\"" á|stories about my friend and that girlfriend."""
disgust,emotional_events,A friend of mine came to see me when he was quite drunk.
disgust,emotional_events,"A friend once reacted childishly (he is 23 yearrs old) to my not responding in his favour to a request, that is: he asked me for some money I refused, and his reaction was quite childish."
disgust,fairytale_sentences,"And I feel sure that Anna Maria pockets things--
noemo	fairytale_sentences	Where are all the cream crackers?"""
