label,source,sentence
disgust,emotional_events,"A drunk man attacked his wife and wanted to humiliate her by insulting her. Then he turned violent and started to beat her in front of her child. She left it happen without saying a word in order not to make things worse. I watched the scene and tried to calm the man, but without success. Just because he was stronger we had to comply. From that day I detested him."
disgust,emotional_events,[ No response.]
disgust,emotional_events,When I found out some family friends were embezzelling the company they worked for - using company petrol and food supplies and claiming furniture and crockery.
disgust,emotional_events,This happened when I went to visit my friend in Chelston and found him screwing my girlfriend.
disgust,emotional_events,When I think now about the way my father behaved when filing a divorce.
disgust,emotional_events,A condition in which I was disgusted followed when I lost money on my way home from the college.
disgust,fairytale_sentences,"Dance you shall, dance- !"""
disgust,emotional_events,A relative not acting on her promise.
disgust,emotional_events,A piece of work was marked as bad by the teachers I and some fellow students didn't agree with their vague criticism. I felt myself taken in by the teachers and felt disgust.
disgust,artificial_sentences,Leonora shook her head in revulsion .
disgust,emotional_events,When my mother's new husband treated her and my brothers and sisters badly.
disgust,tweets,this weekends abouttttto SUCK
disgust,artificial_sentences,"In an increasingly health-conscious world , executives from Brazil to Britain have become increasingly fed-up with luncheon excesses ."
disgust,emotional_events,I felt disgusted on seeing my boyfriend after our separation.  One day he was begging at the mass transit railway station and at that moment I hated him.
disgust,emotional_events,I had intercourse with someone and then I realized that what I had done was wrong and it disgusted me.
disgust,emotional_events,"I was disgusted from a quarrel between two married people, in which the children were involved as accusers of one of the parents."
disgust,fairytale_sentences,"Out with you, you idle, good-for-nothing creatures! cried they; ""we cannot find food for you any longer; you are big enough, and can provide for yourselves."""
disgust,emotional_events,When I was a child I broke plates because I wasn't given food on the grounds of coming home late.
disgust,emotional_events,When I noticed two spiders running on the floor in different directions.
disgust,tweets,Listening to maylene and wondering why cant I pull off as many cool southern metal licks as them
disgust,emotional_events,"When some people, including me, are treated in a way which equates them to an animal or a thing."
disgust,emotional_events,When I heard that a woman of my community had aborted and got rid of the foetus by throwing it in the drain.
disgust,emotional_events,One of my good friends told people something I had told her in confidence about someone else.
disgust,emotional_events,"When I had exams a relative of ours, who lives in another city,á came to visit us and I felt disgusted at him."
disgust,fairytale_sentences,"The third said, ""I grant that she may die a miserable death."""
disgust,emotional_events,At work when I did not get the full co-operation of my colleagues to complete an assignment.
disgust,fairytale_sentences,"Oh, said the other beetles, ""this fellow that we have received into our family is nothing but a complete vagabond."
disgust,emotional_events,I was insulted without a reason by a drunk man.
disgust,artificial_sentences,"However , the existence of a potential rival , no matter how eccentric , meant that there was an alternative fascist allegiance open to disgruntled members of the BUF ."
disgust,emotional_events,"After joining my M.A in Social Sciences, I appeared for the first semester exam.  I failed one of the exams, and when I looked at my results I felt disgusted and then I got angry."
disgust,fairytale_sentences,"Then the rich man looked at the traveler from head to foot, and as the Lord was wearing common clothes, and did not look like one who had much money in his pocket, he shook his head, and said, ""No, I cannot take you in, my rooms are full of herbs and seeds; and if I were to lodge everyone who knocked at my door, I might very soon go begging myself."
disgust,emotional_events,When I found my girl in bed with another man.
disgust,emotional_events,I was forced to stay in the canteen and eat the food that I had not asked for but got it anyway.
disgust,emotional_events,Once when I was babysitting for some neighbors children I found roaches in ther bathroom. I had never seen a roach before but I called my mother to make sure that's what they were. And she came over and checked.
disgust,fairytale_sentences,"I am old, and you are old, but we may live for each other just the same; as to marrying- no; don't let us appear ridiculous at our age."""
disgust,emotional_events,"When I saw the film \Memorie of Prison\"" I saw a scene of á|masturbation of a man in the hold of a ship apart form fact that á|the film wasn't pleasant I had a leg of coconut candies in my á|hands."""
disgust,emotional_events,"As a child, when I saw an \unesthetic\"" sight."""
disgust,emotional_events,"I was on my way home by bus.  A man who had drunk a fair amount of alcohol started talking, trying to hug and pat a woman sitting next to him.  Fortunately it was not me."
disgust,emotional_events,"Many times, when my father used to come home drunk and maltreated physically me and my mother."
disgust,tweets,should probably do some house work  for my mummy think id better. would cook dinner but im a shit cook lol xx
disgust,emotional_events,When I saw President Reagan get elected.
disgust,emotional_events,A few days back I was waiting for the bus at the bus stop.  Before getting into the bus I had prepared the exact amount of coins to pay for the bus fair and when I got into the bus I put these coins into the box meant to collect the bus fair.  I thought that I had paid and wanted to get inside.  However the bus driver called me and asked me in an impolite way if the coins were stuck at the opening  of the box.  He had not seen me paying and there wasn't a stack of coins in the box.  I could not understand this and the driver kept questioning me.  He made me feel angry and at last i inserted a dollar coin in the box just to get away from him.  Later I found that I had forgotten a few coins in my pocket and had not paid enough for the fair the first time.  After I had entered the bus I could still hear him scolding me and I felt disgusted.
disgust,emotional_events,A friend of mine remembered me when she needed me and did not even think about me when she did not need me.
disgust,emotional_events,I felt disgusted about a teacher who had rejected all that was human in her. She refused to accept the flowers we gave her for the eighth of March and asked for a foreign parfume instead.
disgust,emotional_events,I once saw a programme on TV describing how certain wild life films were made and was disgusted by the treatment of certain animals in this particular programme of the polar bear.
disgust,emotional_events,I felt disgusted when a certain lady spoke words of sarcasm when I was trying to propose to her.
disgust,emotional_events,"My classmate at TISS has the habit of biting his nails and ever since my childhood I have never liked this habit.  This person is near me in class, dining hall and the campus so I suggested that he should stop biting his nails.  However he found it difficult and my disgust feelings have not changed."
disgust,emotional_events,"It happened that one of my best friends just took my shirt without my knowledge, I hadn't put it on for many days and I was short of clothes."
disgust,emotional_events,"In a lift a drunken, fat and untidy man tried to make advances at me."
disgust,emotional_events,To loose friends because of them over-estimating themselves.
disgust,emotional_events,I was disgusted when my brother was arrested because of stealing money.
disgust,emotional_events,"Disgust - no. Maybe it is more precise to say revultion at a worm or a snake. But I mean it in a social aspect when somebody had behaved like a scoundrel to you, when by his actions he has made you change your attitude towards him but I thing this feeling the way I meant it, is not typical for the people interrelations."
disgust,fairytale_sentences,"No one ever places it in a nosegay; it is often trodden under foot, there are so many of them; and when they run to seed, they have flowers like wool, which fly away in little pieces over the roads, and cling to the dresses of the people.
disgust	fairytale_sentences	They are only weeds; but of course there must be weeds.
joy	fairytale_sentences	O, I am really very thankful that I was not made like one of these flowers."
disgust,fairytale_sentences,"Wanting! cried the guardian angel; ""nothing must be wanting here; and if it is so, let us fetch it; let us seek the powerful fairy; let us go to her."""
disgust,emotional_events,I went to a party with my boyfriend who got so drunk and started vomiting. It was so disgusting.
disgust,emotional_events,"Yesterday, I was just about to cross the road when a country guy who was ahead of me spat out a mouthful of betel juice on the road.  It was very windy and had I not checked my speed I would have had a very good shower of his saliva.  Though I was not angry, I felt that these people were very indecent."
disgust,tweets,"At every gas station, I look for postcards for    No luck."
disgust,emotional_events,I saw a film where snakes were crawling everywhere. I felt them crawling over all my body with that ... skins. The noise that they did disturbed me very much.
disgust,fairytale_sentences,"They rolled their eyes, and mother owl, beating her wings, said: ""Don't listen to her!"
disgust,emotional_events,I saw a friend's husband with another woman.
disgust,emotional_events,On boat trip - saw mother giving young child (aprox 6-7 years) cigarettes.
disgust,fairytale_sentences,It only looks like something.
disgust,emotional_events,"One day I went to town to get my grocery.  On my way back, I took a mini bus which was full of drunk students.  I felt very disgusted."
disgust,tweets,sitting at the chevy dealership in utah waiting for the van to be fixed
disgust,emotional_events,My father is someone I disgust. So when he comes close to me a feeling of disgust overwhelms me. When I stay a week-end at my parent's place I will remember it for long time.
disgust,emotional_events,I read a newspaper article about dogs being stolen in order to use them for fighting purposes.
disgust,emotional_events,"Once when I had started to write a paper, there was a phone call for me.  I had to go downstairs to receive it and after the conversation I discovered that all the information had disappeared from my mind."
disgust,emotional_events,A saturday night a bus full of drunken people.
disgust,fairytale_sentences,And the black forest snails actually spat at the flower.
disgust,emotional_events,"Outside a night club, a grown man was sitting on top of a younger woman, beating her up."
disgust,emotional_events,Finding that a girlfriend of mine was a prostitute and had been seeing many others during our relationship.
disgust,emotional_events,With a Manager who insists on making crude innuendos pertaining to sex.
disgust,fairytale_sentences,"I was soon very tired of it, although I had my children with me; and, besides, it's very expensive work travelling, very expensive."
disgust,emotional_events,We were at a hamburger bar and a man at a table nearby started coughing and spitting into his plate.
disgust,emotional_events,A female friend was violently ill on the return journey from a wedding reception we attended. Getting her out of the car when home took quite a while.
disgust,fairytale_sentences,"So he turned his horse round, and brought the false bride back to her home, and said, ""This is not the right bride; let the other sister try and put on the slipper."""
disgust,emotional_events,When I lost the notes of the lecturer I had borrowed from my friend.
disgust,tweets,is bored. my BFF doesn't want to hang out
disgust,emotional_events,Can't remember any such feelings now.
disgust,emotional_events,A close friend took part in a racist violent action.
disgust,emotional_events,"A girlfriend of mine behaves in a very childish way - she does not like my going to see a friend who has been introduced to me by this same friend of mine.  I would like to be friends with both of them, but she does not like this as she is possessive and would like me to be close only to her."
disgust,emotional_events,I felt disgusted while studying for my applied psychology and mental testing papers in B.A.
disgust,artificial_sentences,"Be prepared to train twice as hard on your weaker side and each time you feel fed-up through lack of progress , switch to your stronger side to give yourself a boost ."
disgust,emotional_events,When I see all the putridness of people. The fact is the catarrh and spits that whash the streets of S.Paulo.
disgust,emotional_events,Saw a scene in a movie implying incest as humorous.
disgust,emotional_events,"On a camp - boys and girls in one cabin. One guy forced himself upon another girl and was having intercourse, while the girl in the bunk beneath was pretending to be asleep and not be ill."
disgust,fairytale_sentences,"You must not say that, said Big Claus; ""for only one of them belongs to you."""
disgust,emotional_events,Sitting in the dorm when the guys were verbally reading letters in Penthouse.
disgust,artificial_sentences,FACTORY workers fed-up with secretary Carolyn Bullock 's dodgy parking hoisted her car on to the firm 's roof with a crane .
disgust,fairytale_sentences,"Somehow there were very extra-- ordinary noises overhead, which disturbed the dignity and repose of the tea party."
disgust,emotional_events,In ward 2A there was a patient suffering from Syphilitic Paraplegia and had pressure sores. The wounds had offensive smell that only a few people .... the place.
disgust,emotional_events,"While watching a film of an experimental operation on a cat's brain in which the cat had metal pieces protruding from its eyes, mouth etc. to keep the head stable while being cut open."
disgust,tweets,is tired. 04:30 alarm setting will do that  Off to bed as soon as my bloody iPhone Backup and Sync finishes.
disgust,emotional_events,"A friend of mine was telling jokes which I felt to be very disgusting, especially because I was eating."
disgust,emotional_events,When my cousin put feaces in my washing.  A silly idea which was meant to be a joke.
disgust,emotional_events,"I had a friend who was very kind to me.  I tried my best to like him and understand him but when I was with him I could not help rejecting, criticizing and blaming him.  I wanted to get away from him as soon as possible."
disgust,emotional_events,A friend told me how he managed to win the sympathy of as many people as possible. He said he first listened to what they said and then he tried to only say things they would like to hear. He would never express his own opinion. I felt really disgusted when he told that.
disgust,emotional_events,A drunk man had fallen in the street and he was shouting obscene words.
disgust,emotional_events,When my oldest sister discovered that her boyfriend had another girl.
disgust,emotional_events,I cannot remember exactly such a situation. But I know that once I went to a very dirty lavatory and that disgusted me.
disgust,emotional_events,During military service I heard the story of someone who tried to commit suicide and as a result of this got a week custody.
disgust,emotional_events,"When I had to eat scraps from a dust-bin, because of a bet."
disgust,fairytale_sentences,It is a sad thing for her pretty little son.
disgust,emotional_events,Because of the examination I had to study night and day.
disgust,tweets,fml. forgot alli's dance recital is tonight. now i'm stuck talking to munchkins all night instead of being at devon's bonfire. :/
disgust,tweets,"Wow, kinda bothered that Jon is doing deposits now.  Apparently he keeps getting fucked out of times, but deposits are SO hard for me"
disgust,emotional_events,"I happened to see the video-tape movie \This is America - Part á|one\"" at my friend's place."""
disgust,fairytale_sentences,"Listen to me, and not to them, said the mother stork."
disgust,tweets,Just got home from the BEA ; it was kinda boring (2 me) this year  but hung out with some GREAT authors ; co-workers!
disgust,emotional_events,When I saw a man who hadn't the lower .... in a car exhibition. He was passing a handkerchief from inside to outside of his mouth.
disgust,emotional_events,"After the first of May, I detested my fiance's friends, who had piled on to our party and spoilt it completely."
disgust,fairytale_sentences,"There was something between my brother and her, I remember, said the mayor; ""it is a good thing that she is out of the way, for now the boy will have the whole."
disgust,tweets,why did i agree to work a double shift
disgust,emotional_events,[ No response.]
disgust,emotional_events,They asked me to throw the rubbish into a dustbin which had some awful liquid accumulated at the bottom.
disgust,emotional_events,"Right now I volunteer at a hospital. Yesterday, Halloween, I dressed up as a doctor and went to work. The volunteer coordinator told me after my shift that it was dangerous to have done what I did."
disgust,emotional_events,A friend told me that a boy wanted to get to know me.  At that time I felt disgusted and thought that it was a nonsense thing.
disgust,emotional_events,A teacher giving a test was called by a student by his first name. He (the teacher) said that he didn't give him this liberty.
disgust,emotional_events,First anatomy lesson.
disgust,emotional_events,"Doctors ignored relative who complained about pain, and is now dying of cancer."
surprise,tweets,"Oops, they don't open until 9am"
surprise,tweets,the poetry event was a success. I don't think I ever really thought that my poetry could connect with others. heartache is universal
surprise,tweets,My son's first tooth came out but he left it at school
surprise,fairytale_sentences,"I heard Ribby coming and I had to run out by the back door!"""
surprise,tweets,some of my new followers are pretty cool peeps; check 'em out.
surprise,tweets,good day in the sun... little bit burnt tho... well actualy quite alot  very sore  heh
surprise,tweets,OMG!! that is tragic!
surprise,tweets,"WOMAN, I didn't know you came home  you so suck!!! When are you going back!"
surprise,artificial_sentences,"In front of stunned mourners he told grieving widow Linsay Robinson to ` pay up or else "" ."
surprise,tweets,learning tat the scenic way  din plan to go town but somehow was herded there?
surprise,artificial_sentences,"Miss Logan concealed her astonishment at this curious lecture , but felt bound to enquire further ."
surprise,fairytale_sentences,"And when its song was over, it spread its wings and flew away before them, and they followed it until they reached a little house, on the roof of which it alighted; and when they approached the little house they saw that it was built of bread and covered with cakes, but that the windows were of clear sugar."
surprise,tweets,awwww i have no internet right now....  -drummer boi
surprise,artificial_sentences,"Michael frowned at him , bewildered ."
surprise,tweets,That's very funny.  Cute kids.
surprise,tweets,oh men..not in the mood  I'll go home tomorrow..wanna be w/ my family..its my birthday
surprise,tweets,really? awesome! we love it...and I work at buckhead church too. I love it all around.
surprise,tweets,My #musicmonday offering:  Tony Christie feat. All Seeing I - Walk Like a Panther
surprise,fairytale_sentences,"And after this the real nightingale was banished from the empire, and the artificial bird placed on a silk cushion close to the emperor's bed."
surprise,fairytale_sentences,"Then the daughter gave her some of the water of the fountain to drink, and she became strong and healthy."
surprise,tweets,Catching up on #dollhouse Yay Alan Tudyk aka Wash is in it.
surprise,tweets,"Now, what on earth led you to believe that?"
surprise,tweets,THIS twitter is driving me nuts...WONT LET ME DOWNLOAD A PROFILE PIC!! ...guess i'll keep trying!!
surprise,tweets,"ur taking tease lessons from the guys! No fair   LOL, oh well, we'll wait as patiently as we can!"
surprise,tweets,lol that's great  For you.
surprise,tweets,Look at this !   I can't see them at all. What the heck..
surprise,tweets,Going downstairs for more coffee and socialising  Wow... Only 4:16?.. Gives me time for French later
surprise,fairytale_sentences,"Scarcely, however, had he tasted the bitter sea-water when he became worse even than he was before; and then both the elder sons came in, and blamed the youngest for what they had done; and said that he wanted to poison their father, but that they had found the Water of Life, and had brought it with them."
surprise,tweets,Test discovery just missed being in Py3.1
surprise,tweets,yeaaa i just got the link off his lj
surprise,tweets,"Grinding Skyguard rep. This is less awful than I anticipated. Yet, still awful. Last tabard I need"
surprise,tweets,great party alenka!!  happy birthday chicky! &lt;3
surprise,fairytale_sentences,"Have you learnt how to shudder yet?"""
surprise,fairytale_sentences,"Can one not persuade them to live in peace and quietness, so that each one may mind his own business?"
surprise,tweets,we watched that one day in the middle of playing-- it REALLY doesn't hold up
surprise,artificial_sentences,Paul 's tone and expression showed his puzzlement .
surprise,fairytale_sentences,"I well see, said the king, ""that I owe my thanks to you; can I do anything to please you?"""
surprise,tweets,i have but you know it's not that easy..
surprise,tweets,I forgot about it and I already ate lunch  so I guess I'm not going.
surprise,tweets,why not??  xxx
surprise,tweets,fun who did you go with??? Another park no invite!  LOL
surprise,tweets,"Wow, you still haven't gotten them?"
surprise,tweets,Was about to head downtown...now there's a flash flood!  - Photo:
surprise,fairytale_sentences,"Then I must have been eating MOUSE!
noemo	fairytale_sentences	. . .
noemo	fairytale_sentences	. . .
noemo	fairytale_sentences	But perhaps I should feel worse if I had really swallowed a patty-pan!"
surprise,fairytale_sentences,"Ugh, cried the paper, as it burst into a bright flame; ""ugh."""
surprise,tweets,Feeling good about our win! Its nice being softball champs  bring on the season!
surprise,tweets,"holy crap, I need to see that! Too bad I gotta wait until tomorrow"
surprise,tweets,: Didn't need the shipping forecast we're inland
surprise,tweets,thats awesome!
surprise,tweets,Someone out there will soon  be the lucky recipient of my 5000th Tweet. Oh wait. Shit. THIS was it!
surprise,tweets,Ready for tomorrow. My mommy will get her gift for Mother's Day. Hope she LOVES it!
surprise,tweets,"ok cause the one  S orange is still open. Whew, you just scared me. Sorry the one by you closed"
surprise,fairytale_sentences,"And it looked so pretty, that she took it up and put it into her hair to try it; but the moment it touched her head, the poison was so powerful that she fell down senseless."
surprise,tweets,that's what she said?
surprise,tweets,Happy mothers day  just tried on what I'm gonna wear for breakfast and I curled my hair it took forever
surprise,tweets,Is at the movies with the boyfriend!!
surprise,fairytale_sentences,"Oh! cried the devil, ""what are you doing?"""
surprise,tweets,Ship. I'm stuck.
surprise,tweets,REALLY?  COOL!
surprise,fairytale_sentences,"Then the straw began and said: ""Dear friends, from whence do you come here?"""
surprise,artificial_sentences,"Quick -- sign the register , get out , escape from the puzzlement in her eyes ."
surprise,fairytale_sentences,"Pigling Bland jumped, and looked round."
surprise,tweets,wow we r watching the outsiders  smelly english.
surprise,fairytale_sentences,"Then he pushed him in head first, tied up the sack, and soon swung up the searcher after wisdom dangling in the air."
surprise,tweets,That's one of the reasons we thought &quot;Should we have a kid?&quot;  &quot;Nah - let's get a piano instead.&quot;    You poor buggers
surprise,fairytale_sentences,For a long time she did not know that she had ever had any brothers; for her father and mother took care not to speak of them before her: but one day by chance she heard the people about her speak of them.
surprise,tweets,"Or should I say, ROL!"
surprise,artificial_sentences,Natasha laughed at Maggie 's bewildered expression .
surprise,tweets,Looking forward to a session at the gym
surprise,tweets,They gave me a regular coke instead of diet. Really??
surprise,tweets,The pool doesnt open til tomorrow!
surprise,tweets,"gooooooood night, cant believe tomoroo is cancelled!  but still gonna be a giid night, GNI cant beat them!"
surprise,tweets,"Wolverine Was BOSS! Seriously, And Will.I.Am Was In It, What The Fuck ??"
surprise,tweets,"Upcoming trip...Italy, France and Belgium...yeah.  Sadly, no Germany.  Surprisingly bummed about that.  Almost a tradition."
surprise,fairytale_sentences,"Alas! said the mouse, ""now I see what has happened, now it comes to light!"
surprise,tweets,so yeah...i guess i dont get company this weekend  so who wants to come hang out?
surprise,fairytale_sentences,"But when she began her song, and it reached Roland""s ears, he sprang up and cried: ""I know the voice, that is the true bride, I will have no other!"""
surprise,artificial_sentences,"And she did , leaving a very bewildered Ellie to look round her at the well-equipped kitchen and the gently steaming kettle ."
